subreddit,permalink,score,num_comments,title,body_text,image_url
AskReddit,https://old.reddit.com/r/AskReddit/comments/ablzuq/people_who_havent_pooped_in_2019_yet_why_are_you/,221995,7904,"People who haven't pooped in 2019 yet, why are you still holding on to last years shit?",,
AskReddit,https://old.reddit.com/r/AskReddit/comments/f08dxb/would_you_watch_a_show_where_a_billionaire_ceo/,197610,13309,"Would you watch a show where a billionaire CEO has to go an entire month on their lowest paid employees salary, without access to any other resources than that of the employee? What do you think would happen?",,
AskReddit,https://old.reddit.com/r/AskReddit/comments/iwedc5/what_if_god_came_down_one_day_and_said_its/,195922,10205,"What if God came down one day and said ""It's pronounced 'Jod' then left?",,
AskReddit,https://old.reddit.com/r/AskReddit/comments/draola/how_would_you_feel_about_a_feature_where_if/,186436,2762,"How would you feel about a feature where if someone upvotes a crosspost, the original post is upvoted automatically?",,
AskReddit,https://old.reddit.com/r/AskReddit/comments/kr8op6/how_would_you_feel_about_a_if_you_accidentally/,182979,4295,"How would you feel about a ""if you accidentally scroll to the top, you can go back to where you were,"" button for Reddit?",,
AskReddit,https://old.reddit.com/r/AskReddit/comments/9whgf4/stan_lee_has_passed_away_at_95_years_old/,175375,27570,Stan Lee has passed away at 95 years old,"As many of you know today is day that many of us have dreaded. Stan Lee has passed away at the age of 95. He leaves behind a legacy of superheroes and stories that have touched many people's lives for decades. We wanted to make this thread to honor and remember this wonderful man, so please use it discuss his life, his work,
his cameos
, etc and what they meant to you.
Excelsior!
-The AskReddit mods",
AskReddit,https://old.reddit.com/r/AskReddit/comments/9gx68l/reddit_how_would_you_feel_about_a_law_that_bans/,160331,6713,"Reddit, how would you feel about a law that bans radio stations from playing commercials with honking/beeping/siren noises in them?",,
AskReddit,https://old.reddit.com/r/AskReddit/comments/himsju/bill_gates_said_i_will_always_choose_a_lazy/,154345,14734,"Bill Gates said, ""I will always choose a lazy person to do a difficult job because a lazy person will find an easy way to do it."" What's a real-life example of this?",,
AskReddit,https://old.reddit.com/r/AskReddit/comments/kka536/what_if_earth_is_like_one_of_those_uncontacted/,152120,8555,"What if Earth is like one of those uncontacted tribes in South America, like the whole Galaxy knows we're here but they've agreed not to contact us until we figure it out for ourselves?",,
AskReddit,https://old.reddit.com/r/AskReddit/comments/dcxylq/anthony_bourdain_once_said_theres_a_guy_in_my/,150825,10969,"Anthony Bourdain once said ""There's a guy in my head, and all he wants to do is lay in bed all day long, smoke pot, and watch old movies and cartoons. My life is a series of strategems, to avoid, and outwit that guy"". Who is ""that guy"" for you, and what do you do to avoid him?",,
AskReddit,https://old.reddit.com/r/AskReddit/comments/q18zrj/how_is_everyone_enjoying_reddit_while_instagram/,148724,13772,How is everyone enjoying Reddit while Instagram Facebook and whatsapp are all down?,,
AskReddit,https://old.reddit.com/r/AskReddit/comments/i4r81a/its_more_than_likely_that_covid19_will_still_be/,145253,15815,It's more than likely that Covid-19 will still be around at Christmas time - how are we going to explain to kids that Santa is still allowed to go into millions of houses?,,
AskReddit,https://old.reddit.com/r/AskReddit/comments/99eh6b/without_saying_what_the_category_is_what_are_your/,144675,25919,"Without saying what the category is, what are your top five?",,
AskReddit,https://old.reddit.com/r/AskReddit/comments/ecscwk/what_free_things_online_should_everyone_take/,141634,14643,What free things online should everyone take advantage of?,,
AskReddit,https://old.reddit.com/r/AskReddit/comments/80phz7/with_all_of_the_negative_headlines_dominating_the/,139496,20887,"With all of the negative headlines dominating the news these days, it can be difficult to spot signs of progress. What makes you optimistic about the future?",,
AskReddit,https://old.reddit.com/r/AskReddit/comments/ilcknh/steve_irwin_has_you_pinned_down_in_a_headlock/,137325,5328,"Steve Irwin has you pinned down in a headlock, what cool facts does he tell the audience about you and your habitat?",,
AskReddit,https://old.reddit.com/r/AskReddit/comments/aicgpz/serious_americans_would_you_be_in_support_of/,137176,10377,"[Serious] Americans, would you be in support of putting a law in place that government officials, such as senators and the president, go without pay during shutdowns like this while other federal employees do? Why, or why not?",,
AskReddit,https://old.reddit.com/r/AskReddit/comments/ac9038/iceland_just_announced_that_every_icelander_over/,135265,15208,Iceland just announced that every Icelander over the age of 18 automatically become organ donors with ability to opt out. How do you feel about this?,,
AskReddit,https://old.reddit.com/r/AskReddit/comments/kkmgzr/with_christmas_364_days_away_people_who_already/,133692,3466,"With Christmas 364 days away, people who already have their decorations up, why?",,
AskReddit,https://old.reddit.com/r/AskReddit/comments/hvsxty/which_legendary_reddit_post_comment_can_you_still/,130295,28000,Which legendary Reddit post / comment can you still not get over?,,
AskReddit,https://old.reddit.com/r/AskReddit/comments/jpfqtc/you_go_to_sleep_on_the_31st_of_december_2020_and/,126272,17236,"You go to sleep on the 31st of December 2020 and wake up the next day but when you check your phone, it says January 1st 2020, after the first couple of days you realize it's just like groundhog day, what do you do with the information you have about 2020?",,
AskReddit,https://old.reddit.com/r/AskReddit/comments/70k2ya/how_would_you_feel_about_a_law_that_requires/,124618,10376,How would you feel about a law that requires people over the age of 70 to pass a specialized driving test in order to continue driving?,,
AskReddit,https://old.reddit.com/r/AskReddit/comments/ejfvct/the_pope_slapped_a_woman_on_day_1_of_2020_world/,123050,12726,"The Pope slapped a woman on day 1 of 2020, world war III is trending on day 2, what will happen on day 3?",,
AskReddit,https://old.reddit.com/r/AskReddit/comments/f60oog/how_would_you_feel_if_the_only_thing_we_knew/,120837,7026,"How would you feel if the only thing we knew about presidential candidates was their stance on issues...no information on party, name, gender, race, or religious beliefs (or lack thereof)?",,
AskReddit,https://old.reddit.com/r/AskReddit/comments/jg4rw0/turns_out_2021_is_just_a_bizarre_and/,120724,16748,"Turns out 2021 is just a bizarre and unprecedented as 2020, except its all good things that keep happening, what are they?",,
AskReddit,https://old.reddit.com/r/AskReddit/comments/grst2b/police_officers_of_reddit_what_are_you_thinking/,120162,23758,"Police Officers of Reddit, what are you thinking when you see cases like George Floyd?",,
AskReddit,https://old.reddit.com/r/AskReddit/comments/n128oc/people_who_have_only_fans_what_is_stopping_you/,118608,4697,"People who have Only fans, what is stopping you from upgrading to an air conditioner?",,
AskReddit,https://old.reddit.com/r/AskReddit/comments/1ndskqc/why_do_you_think_president_trump_ordered_all_us/,118530,9369,"Why do you think President Trump ordered all US Flags at half staff for the death of a Political Commentator, but not for the death of actual Legislators?",,
AskReddit,https://old.reddit.com/r/AskReddit/comments/h8d0k0/how_would_you_feel_about_a_return_to_where_you/,118421,2693,"How would you feel about a ""return to where you left off"" button for Reddit?",,
AskReddit,https://old.reddit.com/r/AskReddit/comments/l2d1la/at_921_tonight_it_will_be_the_21st_minute_of_the/,117823,10230,"At 9:21 tonight, it will be the 21st minute of the 21st hour of the 21st day of the 21st year of the 21st century. What will you be doing?",,
AskReddit,https://old.reddit.com/r/AskReddit/comments/84anfy/professor_stephen_hawking_has_passed_away_at_the/,117207,2684,Professor Stephen Hawking has passed away at the age of 76,"We have lost one of the greatest minds in history today as Professor Stephen William Hawking has passed away on March 14, 2018 at the age of 76.
It is a terrible loss and we wanted to create this thread for people to share their thoughts about Professor Hawking, from favorite quotes, to theories, to whatever he and his work meant to you.
We also would recommend checking out the
AMA he did a couple of years ago
. Additionally,
here is a link
to his official website.
Edit: We are also including a link to
The Stephen Hawking Foundation
in case anyone is interested in donating in honor of his memory.
The Stephen Hawking Foundation was established on the initiative of Professor Stephen Hawking to facilitate research into Cosmology, Astrophysics and Fundamental Particle Physics both at school and university level. It will also facilitate and support work relating to Motor Neurone Disease and those living with the disease.",
AskReddit,https://old.reddit.com/r/AskReddit/comments/hvbvpz/what_life_changing_item_can_you_buy_for_less_than/,115373,43821,What life changing item can you buy for less than $100?,,
AskReddit,https://old.reddit.com/r/AskReddit/comments/gk8t35/george_carlin_said_think_of_how_stupid_the/,113603,28995,"George Carlin said “Think of how stupid the average person is, and realize half of them are stupider than that.” What real life example have you seen that validates this view?",,
AskReddit,https://old.reddit.com/r/AskReddit/comments/d0jjc2/the_2010s_decade_will_be_over_in_4_months_what_do/,113252,23084,The 2010's decade will be over in 4 months. What do you think people will remember this decade for?,,
AskReddit,https://old.reddit.com/r/AskReddit/comments/k18dam/how_do_you_cope_with_being_treated_like_you_are/,112650,14913,"How do you cope with being treated like you are crazy for following covid safety guidelines, when others around you aren’t doing the same?",,
AskReddit,https://old.reddit.com/r/AskReddit/comments/yiazab/would_you_support_a_mandatory_retirement_age_of/,112578,14644,"Would you support a mandatory retirement age of 75 for US House, US Senate & US Supreme Court Justices and if not why?",,
AskReddit,https://old.reddit.com/r/AskReddit/comments/mlczdu/youre_offered_the_ability_to_absorb_the_knowledge/,112534,11811,"You're offered the ability to absorb the knowledge of any book you touch instantly, but the way it works is that time freezes and won't unfreeze until you finish reading the book cover to cover, do you accept this power/curse? Why or why not?",,
AskReddit,https://old.reddit.com/r/AskReddit/comments/euoqp6/girls_who_took_notes_using_50_different_colored/,111829,9662,"Girls who took notes using 50 different colored pens, where are you now? Do you still continue to write using all those colors?",,
AskReddit,https://old.reddit.com/r/AskReddit/comments/foslu3/if_covid19_wasnt_dominating_the_news_right_now/,110088,20911,"If Covid-19 wasn’t dominating the news right now, what would be some of the biggest stories be right now?",,
AskReddit,https://old.reddit.com/r/AskReddit/comments/hsirrq/what_is_something_free_from_the_internet_everyone/,109424,10617,What is something free from the internet everyone should take advantage of?,,
AskReddit,https://old.reddit.com/r/AskReddit/comments/awmdb2/you_have_just_been_cheated_out_of_1000_for_a/,107373,5650,You have just been cheated out of $1000 for a stupid brick. How do you take revenge?,,
AskReddit,https://old.reddit.com/r/AskReddit/comments/f4p0yw/a_new_dating_app_is_launched_instead_of_a_photo/,105403,12629,"A new dating app is launched. Instead of a photo of the person, it shows you a photo of their bedroom, car, kitchen, shoes, how they have their tea/coffee, things like that... what photo would tell you the most about someone, and would you be most interested to see to choose a potential date?",,
AskReddit,https://old.reddit.com/r/AskReddit/comments/atn6h6/you_gain_control_of_jk_rowlings_twitter_account/,104985,15708,You gain control of JK Rowling's twitter account for a day. What unnecessary piece of information do you add to Harry Potter lore?,,
AskReddit,https://old.reddit.com/r/AskReddit/comments/ejr5rg/african_proverb_says_the_child_who_is_not/,104555,7501,"African Proverb Says ""The child who is not embraced by the village will burn it down to feel the warmth"" What time in your life have you been closest to starting the fire?",,
AskReddit,https://old.reddit.com/r/AskReddit/comments/e18g6m/if_ok_boomer_was_a_digital_assistant_like_ok/,104515,10749,If “OK Boomer” was a digital assistant like “OK Google” what sorts of answers would it give you to certain questions?,,
AskReddit,https://old.reddit.com/r/AskReddit/comments/kxbzv3/former_flat_earthers_what_made_you_come_round/,104516,8860,Former Flat Earthers. What made you come round?,,
AskReddit,https://old.reddit.com/r/AskReddit/comments/i3dk8c/how_would_you_feel_if_the_us_government_made_the/,104462,10468,"How would you feel if the U.S. government made the day for voting, a holiday?",,
AskReddit,https://old.reddit.com/r/AskReddit/comments/8pks1u/suicide_prevention_megathread/,104341,15769,Suicide Prevention Megathread,"With the news today of the passing of the amazing Anthony Bourdain and the also the very talented Kate Spade a couple of days of ago, we decided to create a megathread about suicide prevention. So many great and talented people have left the world by way of suicide, not just those are famous, but friends and family members of everyday people.
That's why we would like to use this thread for those that have been affected by the suicide of someone to tell your story or if you yourself have almost ended your life, tell us about what changed.
If you are currently feeling suicidal we'd like to offer some resources that might be beneficial:
https://www.iasp.info/resources/Crisis_Centres
http://www.befrienders.org/
(has global resources and hotlines)
http://www.suicidepreventionlifeline.org/GetHelp/LifelineChat.aspx
http://www.samaritans.org/how-we-can-help-you
[UK]
https://www.lifeline.org.au/Get-Help/
[AU]
http://www.crisistextline.org
https://www.nami.org/Learn-More/Mental-Health-Conditions/Related-Conditions/Risk-of-Suicide
https://www.thetrevorproject.org
http://youthspace.ca
https://www.veteranscrisisline.net/
Please be respectful and ""Remember the Human"" while participating in this thread and thank you to everyone that chooses to share their stories.
-The AskReddit Moderators",
AskReddit,https://old.reddit.com/r/AskReddit/comments/fcnqpg/if_instead_of_rebooting_movies_retelling_them/,103859,17919,"If instead of rebooting movies, retelling them from a different point of view became popular, which movie would you like retold?",,
AskReddit,https://old.reddit.com/r/AskReddit/comments/mdlbrp/how_the_f_do_you_make_friends_as_an_adult_if_you/,103686,17273,How the F do you make friends as an adult if you don't drink?,,
AskReddit,https://old.reddit.com/r/AskReddit/comments/jx6m5s/doctors_of_reddit_whats_it_like_when_you_go_in/,103332,5492,"Doctors of reddit, what’s it like when you go in for a doctors appointment? Do you and your doctor discuss what’s wrong with you like it’s a group project? Do you not go at all because you’re your own doctor?",,
AskReddit,https://old.reddit.com/r/AskReddit/comments/f937om/what_is_the_coolest_website_youve_visited_that_no/,102894,13192,What is the coolest website you’ve visited that no one knows about?,,
AskReddit,https://old.reddit.com/r/AskReddit/comments/lec25l/how_would_you_feel_about_a_tv_show_similar_to/,102139,3875,"How would you feel about a TV show similar to ""Undercover Boss"", but instead of companies they secretly infiltrate and film police forces?",,
AskReddit,https://old.reddit.com/r/AskReddit/comments/bekeb1/what_mindblowing_but_simple_facts_would_satisfy_a/,101376,20144,What mind-blowing (but simple) facts would satisfy a 4-year old daughter’s daily request for 1 fact before bedtime?,,
AskReddit,https://old.reddit.com/r/AskReddit/comments/ew09zv/it_has_now_been_6969_days_since_the_year_2000_how/,100730,8265,It has now been 6969 days since the year 2000. How will you celebrate this monumental day?,,
AskReddit,https://old.reddit.com/r/AskReddit/comments/cnhcty/people_who_downloaded_their_google_data_and_went/,100610,11424,"People who downloaded their Google data and went through it, what were the most unsettling things you found out they had stored about you?",,
AskReddit,https://old.reddit.com/r/AskReddit/comments/js8e1z/therapists_of_reddit_what_was_your_biggest_i_know/,100166,13231,"Therapists of reddit, what was your biggest ""I know I'm not supposed to judge you but holy sh*t"" moment?",,
AskReddit,https://old.reddit.com/r/AskReddit/comments/hzdh0g/what_do_you_know_is_true_without_evidence_what/,99671,50211,"What do you KNOW is true without evidence? What are you certain of, right down to your bones, without proof?",,
AskReddit,https://old.reddit.com/r/AskReddit/comments/ivici8/ruth_bader_ginsburg_us_supreme_court_justice/,99512,10287,"Ruth Bader Ginsburg, US Supreme Court Justice, passed at 87","As many of you know, today
Ruth Bader Ginsburg
passed away at 87. She was affectionately known as Notorious R.B.G. She joined the Supreme Court in 1993 under Bill Clinton and despite battling cancer 5 times during her term, she faithfully fulfilled her role until her passing. She was known for her progressive stance in matters such as abortion rights, same-sex marriage, voting rights, immigration, health care, and affirmative action.",
AskReddit,https://old.reddit.com/r/AskReddit/comments/m1iyga/how_would_you_feel_if_reddit_added_a_feature/,99335,3423,"How would you feel if Reddit added a feature where you could still use your normal account, but then have an option to press a button on your account and post anonymously rather then creating a throwaway?",,
AskReddit,https://old.reddit.com/r/AskReddit/comments/f1irzw/people_who_can_fall_asleep_within_8_seconds_of/,99272,14996,People who can fall asleep within 8 seconds of their head hitting their pillow: how the fuck do you fall asleep within 8 seconds of your head hitting your pillow?,,
AskReddit,https://old.reddit.com/r/AskReddit/comments/l6o4jb/how_would_you_feel_about_school_taking_up_an/,98988,11529,"How would you feel about school taking up an extra hour every day to teach basic ""adult stuff"" like washing clothes, basic cooking, paying taxes?",,
AskReddit,https://old.reddit.com/r/AskReddit/comments/izk9gh/what_was_the_best_you_have_no_power_here_moment/,98614,17731,"What was the best ""you have no power here"" moment you have ever seen?",,
AskReddit,https://old.reddit.com/r/AskReddit/comments/eic8yl/youre_given_the_option_to_drop_what_you_have_and/,98563,15955,"You're given the option to drop what you have and return to 12/31/2011 as yourself at that age, but with the extra 8 years of experience. Do you take it? Why or why not?",,
AskReddit,https://old.reddit.com/r/AskReddit/comments/myeqin/as_a_2030_year_old_you_are_offered_the_chance_to/,98433,7556,"As a 20-30 year old, you are offered the chance to live rent-free in a retirement or nursing home with the caveat that you must make an effort to spend at least a few hours/day with the other residents (sharing meals, hanging out, etc...). Would you take this opportunity and why or why not?",,
AskReddit,https://old.reddit.com/r/AskReddit/comments/depwkk/what_looks_easy_peasy_lemon_squeezy_but_is/,97466,16683,What looks easy peasy lemon squeezy but is actually difficult difficult lemon difficult?,,
AskReddit,https://old.reddit.com/r/AskReddit/comments/hjwnge/what_are_some_methods_you_can_use_to_protect_your/,97427,5886,What are some methods you can use to protect your lemon tree from the lemon stealing whores?,,
AskReddit,https://old.reddit.com/r/AskReddit/comments/imz8ly/australians_of_reddit_since_no_peace_treaty_has/,97113,3052,"Australians of Reddit, since no peace treaty has been signed to officially conlude the Emu War, how has life in this constant state of war been for you?",,
AskReddit,https://old.reddit.com/r/AskReddit/comments/afzfa7/admins_of_reddit_whats_your_favorite_subreddit/,97040,10714,"Admins of Reddit, what's your favorite subreddit?",,
AskReddit,https://old.reddit.com/r/AskReddit/comments/gvj9a9/i_cant_breathe_black_lives_matter/,96761,6695,I can’t breathe. Black lives matter.,"As the gap of the political divide in our world grows deeper, we would like to take a few minutes of your time or express our support of equal treatment, equal justice, to express solidarity with groups which have been marginalized for too long, and to outright say black lives matter. The AskReddit moderators have decided to disable posting for
8 minutes and 46 seconds
— the time George Floyd was held down by police — and we will lock comments on front page posts. Our hope is that people reading this will take a moment to pause and reflect on what can be done to improve the world.
This will take place at 8PM CDT.
AskReddit is a discussion forum with which we want to encourage discussion of a wide range of topics. Now, more than ever, it’s important to talk about the topics that divide us and use AskReddit to approach these conversations with open minds and respectful discussion.
This is also an important opportunity to reiterate our stance on moderation. Simply put, we believe it’s our duty to ensure neutral and fair moderation so people with opposing views can use our platform as a place to have these important and much needed discussions about their views, our hope being that the world will benefit as a result. We feel that it is our duty to make sure that AskReddit is welcoming to all. To that end, we have a set of rules to ensure posts encourage discussion and to ensure users feel safe, welcome, and respected. As always, blatant statements of racism or any other kind of bigotry
will not be tolerated
. We want users to be able to express themselves and their views. Remember that everyone here and everyone you see in the news are human beings, too.
With all of that in mind, we reiterate our encouragement for people to discuss these hard, and often uncomfortable, topics as a way to find alignment, unity, and to progress as a society.
We ask that you take a few minutes to research a charity that aligns with your beliefs or a cause you care about and that you donate to it if you’re able.
Rolling Stone
put together a lot of links to different funds across many states if you would like to use this as a place to start.
-The AskReddit mods",
AskReddit,https://old.reddit.com/r/AskReddit/comments/kw6dfk/martin_luther_king_jr_said_if_you_cant_fly_then/,96686,4896,"Martin Luther King, Jr. said, “If you can’t fly then run, if you can’t run then walk, if you can’t walk then crawl, but whatever you do you have to keep moving forward.” What are your life examples of this?",,
AskReddit,https://old.reddit.com/r/AskReddit/comments/jb1el5/women_of_reddit_what_do_you_think_about_the_fall/,96206,4432,"Women of reddit, what do you think about the fall of constantinople in 1453 by the ottoman forces led by Mehmed II?",,
AskReddit,https://old.reddit.com/r/AskReddit/comments/d5ye2u/when_youre_lying_in_bed_at_night_do_you_ever/,96152,8696,"When you're lying in bed at night, do you ever randomly remember some relatively minor social missteps or poorly chosen words you did/said years earlier? And then beat yourself up over it even though it really wasn't a big deal? If so, what happened?",,
AskReddit,https://old.reddit.com/r/AskReddit/comments/eio3qj/how_would_you_feel_about_a_ban_of_how_would_you/,95871,2946,How would you feel about a ban of “how would you feel” questions on the sub?,,
AskReddit,https://old.reddit.com/r/AskReddit/comments/i6jmrl/whats_your_favorite_poverty_meal_that_you_still/,95878,39275,What's your favorite poverty meal that you still eat regardless of where you are financially?,,
